id,title,content,syllabus,status,date
1,Oedipus Rex - Fate vs Free Will,"<p>Greek tragedy, as defined by Aristotle in his Poetics, is the imitation of a serious and complete action that evokes pity and fear, leading to catharsis. Oedipus Rex by Sophocles stands as the finest example of classical Greek tragedy, fulfilling almost all Aristotelian principles.Oedipus Rex presents one of the most profound explorations of the conflict between fate and free will in Greek tragedy. According to classical Greek belief, human destiny is predetermined by divine forces, yet individuals attempt to exercise autonomy.



One of the central features of Greek tragedy is the tragic hero—a man of noble stature who possesses a fatal flaw (hamartia). Oedipus, the king of Thebes, is intelligent and determined but also excessively proud and impulsive. His determination to uncover the truth about the plague in Thebes ultimately leads to his downfall. His hamartia is not moral weakness but an error in judgment.



Oedipus begins as a respected and powerful king but ends as a blind and broken man. Closely related is anagnorisis (recognition), when Oedipus realizes that he himself is the murderer of his father and the husband of his mother. This moment of self-realization intensifies the tragic effect. The prophecy that Oedipus will kill his father and marry his mother is the central driving force of the narrative. Despite his conscious efforts to avoid this fate—by leaving Corinth—he unknowingly fulfills it. This paradox suggests that human actions, even those driven by free will, ultimately serve the larger design of fate. Thus, another important element of the Greek tragedy i.e. peripeteia (reversal of fortune) is evident in Oedipus Rex.



A significant feature is the dominance of fate. The prophecy that Oedipus will kill his father and marry his mother is fulfilled despite all efforts to avoid it. This reflects the Greek belief in the inevitability of destiny. From a deterministic perspective, fate is absolute and unavoidable. However, Oedipus’ own actions contribute to the fulfillment of this fate, suggesting a complex interplay between fate and free will. Scholars argue that Oedipus is a victim of cosmic irony, where knowledge leads not to empowerment but to destruction. His relentless pursuit of truth, often seen as an exercise of free will, ironically accelerates his downfall.



However, a humanist interpretation emphasizes Oedipus’ agency. His tragic flaw (hamartia) lies in his pride and impulsiveness. Thus, while fate sets the framework, his personal choices contribute significantly to the tragic outcome.



In conclusion, the play suggests a complex interdependence: fate provides the structure, but free will determines the path through which that fate is realized. This duality enhances the tragic intensity of the play.</p><p style="text-align:center;">
    <img src="https://i.ibb.co/vxbcP1W0/1774464865555.png" style="width:100%; max-width:600px; border-radius:12px; border:1px solid #ddd; margin:20px 0;">
</p>",European Classical Literature,Published,19-03-2026
2,Features of the Greek Tragedy with reference to Oedipus Rex,"<p>Greek tragedy, as defined by Aristotle in his Poetics, is the imitation of a serious and complete action that evokes pity and fear, leading to catharsis. Oedipus Rex by Sophocles stands as the finest example of classical Greek tragedy, fulfilling almost all Aristotelian principles.



One of the central features of Greek tragedy is the tragic hero, a man of noble stature who possesses a fatal flaw (hamartia). Oedipus, the king of Thebes, is intelligent and determined but also excessively proud and impulsive. His determination to uncover the truth about the plague in Thebes ultimately leads to his downfall. His hamartia is not moral weakness but an error in judgment.



Another important element is peripeteia (reversal of fortune). Oedipus begins as a respected and powerful king but ends as a blind and broken man. Closely related is anagnorisis (recognition), when Oedipus realizes that he himself is the murderer of his father and the husband of his mother. This moment of self-realization intensifies the tragic effect.



The play also demonstrates unity of action, focusing on a single plot without subplots. The entire narrative revolves around the search for the truth. The unity of time and place is also largely maintained, as the action occurs within a single day and location.



A significant feature is the dominance of fate. The prophecy that Oedipus will kill his father and marry his mother is fulfilled despite all efforts to avoid it. This reflects the Greek belief in the inevitability of destiny. However, Oedipus' own actions contribute to the fulfillment of this fate, suggesting a complex interplay between fate and free will.



Dramatic irony is another powerful device. The audience is aware of Oedipus' true identity long before he realizes it himself. His repeated assertions of seeking justice ironically condemn him.



Finally, the play produces catharsis, purging the audience's emotions of pity and fear. We pity Oedipus for his tragic fate and fear the possibility of such suffering in human life.



In conclusion, Oedipus Rex perfectly embodies the principles of Greek tragedy through its structure, characterization, and thematic depth, making it a timeless masterpiece.</p>",European Classical Literature,Published,25-03-2026
